{
  "schema_version": 1,
  "exported_at": "2026-07-28T11:35:00Z",
  "sensor": {
    "id": "picket-1",
    "public_ip_sha256": "aaaaaaaaaaaaaaaaaaaaaaaaaaaaaaaaaaaaaaaaaaaaaaaaaaaaaaaaaaaaaaaa",
    "protocols": [
      "SSH",
      "TELNET"
    ],
    "uptime_minutes": 4320,
    "knockknock_version": "1.9.0",
    "country": "DE"
  },
  "totals": {
    "knocks_total": 9001,
    "since": "2026-07-25T11:35:00Z"
  },
  "ring": {
    "bucket_minutes": 30,
    "buckets": [
      0,
      0,
      0,
      0,
      0,
      0,
      0,
      0,
      0,
      0,
      0,
      0,
      0,
      0,
      0,
      0,
      0,
      0,
      0,
      0,
      0,
      0,
      0,
      0,
      0,
      0,
      0,
      0,
      0,
      0,
      0,
      0,
      0,
      0,
      0,
      0,
      0,
      0,
      0,
      0,
      0,
      0,
      0,
      0,
      0,
      0,
      0,
      0,
      0,
      0,
      0,
      0,
      0,
      0,
      0,
      0,
      0,
      0,
      0,
      0,
      0,
      0,
      0,
      0,
      0,
      0,
      0,
      0,
      0,
      0,
      0,
      0,
      0,
      0,
      0,
      0,
      0,
      0,
      0,
      0,
      0,
      0,
      0,
      0,
      0,
      0,
      0,
      0,
      0,
      0,
      0,
      0,
      0,
      0,
      0,
      0,
      0,
      0,
      0,
      0,
      0,
      0,
      0,
      0,
      0,
      0,
      0,
      0,
      0,
      0,
      0,
      0,
      0,
      0,
      0,
      0,
      0,
      0,
      0,
      0,
      0,
      0,
      0,
      0,
      0,
      0,
      0,
      0,
      0,
      0,
      0,
      0,
      0,
      0,
      0,
      0,
      0,
      0,
      0,
      0,
      0,
      0,
      0,
      0,
      0,
      0,
      0,
      0,
      0,
      0,
      0,
      0,
      0,
      0,
      0,
      0,
      0,
      0,
      0,
      0,
      0,
      0,
      0,
      0,
      0,
      0,
      0,
      0,
      0,
      0,
      0,
      0,
      0,
      0,
      0,
      0,
      0,
      0,
      0,
      0,
      0,
      0,
      0,
      0,
      0,
      0,
      0,
      0,
      0,
      0,
      0,
      0,
      0,
      0,
      0,
      0,
      0,
      0,
      0,
      0,
      0,
      0,
      0,
      0,
      0,
      0,
      0,
      0,
      0,
      0,
      0,
      0,
      0,
      0,
      0,
      0,
      0,
      0,
      0,
      0,
      0,
      0,
      0,
      0,
      0,
      0,
      0,
      0,
      0,
      0,
      0,
      0,
      0,
      0,
      0,
      0,
      0,
      0,
      0,
      0,
      0,
      0,
      0,
      0,
      0,
      0,
      0,
      0,
      0,
      0,
      0,
      0,
      0,
      0,
      0,
      0,
      0,
      0,
      0,
      0,
      0,
      0,
      0,
      0,
      0,
      0,
      0,
      0,
      0,
      0,
      0,
      0,
      0,
      0,
      0,
      0,
      0,
      0,
      0,
      0,
      0,
      0,
      0,
      0,
      0,
      0,
      0,
      0,
      0,
      0,
      0,
      0,
      0,
      0,
      0,
      0,
      0,
      0,
      0,
      0,
      0,
      0,
      0,
      0,
      0,
      0,
      0,
      0,
      0,
      0,
      0,
      0,
      0,
      0,
      0,
      0,
      0,
      0,
      0,
      0,
      0,
      0,
      0,
      0,
      0,
      0,
      0,
      0,
      0,
      0,
      0,
      0,
      0,
      0,
      0,
      42
    ]
  },
  "by_protocol": [
    {
      "proto": "SSH",
      "hits_7d": 900,
      "hits_total": 8000
    },
    {
      "proto": "TELNET",
      "hits_7d": 100,
      "hits_total": 1001
    }
  ],
  "top_ips": [
    {
      "ip": "5.6.7.8",
      "hits_7d": 900,
      "hits_total": 8000,
      "first_seen": "2026-07-20T01:00:00Z",
      "last_seen": "2026-07-28T11:00:00Z",
      "protocols": [
        {
          "proto": "SSH",
          "hits_7d": 900
        }
      ],
      "country": "CN",
      "asn": 64500,
      "isp": "Example Hosting",
      "lat": 39.9,
      "lng": 116.4,
      "geo_precision": "city"
    },
    {
      "ip": "9.10.11.12",
      "hits_7d": 100,
      "hits_total": 1001,
      "first_seen": "2026-07-22T09:15:00Z",
      "last_seen": "2026-07-28T10:00:00Z",
      "protocols": [
        {
          "proto": "TELNET",
          "hits_7d": 100
        }
      ],
      "country": "RU",
      "geo_precision": "country"
    },
    {
      "ip": "1.2.3.4",
      "hits_7d": 50,
      "hits_total": 200,
      "first_seen": "2026-07-26T04:00:00Z",
      "last_seen": "2026-07-28T02:00:00Z",
      "protocols": []
    }
  ],
  "top_usernames": [
    {
      "value": "root",
      "hits_7d": 400,
      "hits_total": 3000
    },
    {
      "value": "admin",
      "hits_7d": 300,
      "hits_total": 2500
    }
  ],
  "top_passwords": [
    {
      "value": "123456",
      "hits_7d": 200,
      "hits_total": 1800
    }
  ],
  "top_countries": [
    {
      "iso": "CN",
      "name": "China",
      "hits_7d": 500,
      "hits_total": 4000
    }
  ],
  "top_isps": [
    {
      "isp": "Example Hosting",
      "asn": 64500,
      "hits_7d": 300,
      "hits_total": 2000
    }
  ]
}